{
  "schema": "gah.public-research-index.v1",
  "generated_date": "2026-10-12",
  "publisher": "Grok Archive Hub",
  "canonical_website": "https://grokarchivehub.com",
  "entries": [
    {
      "id": "doj-oip-epstein-review-public-figure-flags-2026",
      "type": "investigation",
      "category": "DOJ review",
      "title": "DOJ's March 2025 Epstein Review Emails: Public-Figure Flags, Victim Protections and the Missing Plan",
      "published": "2026-10-12",
      "modified": "2026-10-12",
      "summary": "A DOJ FOIA release dated October 9, 2026 documents March 2025 public-figure review flags and victim-redaction guidance. The operative plan remains partly withheld; a separate October 9 court order sets an October 16 in-camera deadline.",
      "publication_url": "https://grokarchivehub.com/investigations/doj-oip-epstein-review-public-figure-flags-2026",
      "source_manifest_url": "https://grokarchivehub.com/evidence-data/doj-oip-epstein-review-2026-10-09/source-manifest.json",
      "primary_source_url": "https://www.justice.gov/oip/media/1465356/dl?inline=",
      "evidence_boundary": "March 2025 review instructions and flagged names are not proof of withholding."
    },
    {
      "id": "fbi-vault-redaction-chronology-phang",
      "type": "investigation",
      "category": "Courts and FBI",
      "title": "FBI Vault Part 13: March Redaction Orders, July Statement Emails, and the Phang Case",
      "published": "2026-10-11",
      "modified": "2026-10-12",
      "summary": "FBI Vault Part 13 documents March 22, 2025 redaction guidance and July 3 FBI–DOJ statement coordination. A source audit distinguishes that record from the later Phang v. Blanche administrative-record dispute.",
      "publication_url": "https://grokarchivehub.com/investigations/fbi-vault-redaction-chronology-phang",
      "source_manifest_url": "",
      "primary_source_url": "https://vault.fbi.gov/records-regarding-the-review-of-the-investigative-holdings-related-to-jeffrey-epstein/records-regarding-the-review-of-the-investigative-holdings-related-to-jeffrey-epstein-part-13/at_download/file",
      "evidence_boundary": "2025 FBI redaction records must not be conflated with later court proceedings."
    },
    {
      "id": "wyden-banker-302-deutsche-interviews",
      "type": "investigation",
      "category": "Banking and FBI",
      "title": "Wyden’s Missing Banker 302 vs. Three Public Deutsche Interviews",
      "published": "2026-10-05",
      "modified": "2026-10-05",
      "summary": "DOJ released three Deutsche-linked FBI FD-302 interviews. Wyden says another banker interview report remains unreleased. GAH cross-checks the public 302s, a planned Paul Morris proffer, and the open receipt gap.",
      "publication_url": "https://grokarchivehub.com/investigations/wyden-banker-302-deutsche-interviews",
      "source_manifest_url": "https://grokarchivehub.com/evidence-data/wyden-deutsche-302-gap/source-manifest.json",
      "primary_source_url": "",
      "evidence_boundary": "Three public Deutsche Bank-linked FD-302s do not identify Wyden's unnamed missing banker."
    },
    {
      "id": "jpmorgan-nine-sars-epstein",
      "type": "investigation",
      "category": "Banking and FBI",
      "title": "Nine SARs, $1.28 Billion, and the Reporting Gap in Epstein’s JPMorgan Accounts",
      "published": "2026-10-07",
      "modified": "2026-10-07",
      "summary": "A source-bound reconstruction of nine JPMorgan suspicious-activity reports involving Jeffrey Epstein: seven reports before 2019 totaling $4.3 million, then two 2019 reports covering about $1.283 billion.",
      "publication_url": "https://grokarchivehub.com/investigations/jpmorgan-nine-sars-epstein",
      "source_manifest_url": "",
      "primary_source_url": "",
      "evidence_boundary": "Suspicious-activity reports are transaction reporting, not findings of criminal guilt."
    },
    {
      "id": "epstein-december-6-7-2007-decision-gap",
      "type": "investigation",
      "category": "Justice and victims",
      "title": "December 6–7, 2007: The Victim Letters, the Defense Papers, and the Missing Decision Record",
      "published": "2026-10-07",
      "modified": "2026-10-07",
      "summary": "A source-bound reconstruction of the 48 hours before Jeffrey Epstein victim-notification letters were halted: an FBI warning, defense filings, a native two-minute email sequence, and the unresolved identity behind the final hold.",
      "publication_url": "https://grokarchivehub.com/investigations/epstein-december-6-7-2007-decision-gap",
      "source_manifest_url": "https://grokarchivehub.com/evidence-data/epstein-december-6-7-2007-decision-gap/source-manifest.json",
      "primary_source_url": "",
      "evidence_boundary": "The public record does not establish the decision maker behind the victim-letter hold."
    },
    {
      "id": "barak-gadeco-fee-2014",
      "type": "investigation",
      "category": "Business and documentary history",
      "title": "Why the Chinese Consortium Declined the GADECO Deal: Missing Accounts and a $1.6 Billion Valuation",
      "published": "2026-10-12",
      "modified": "2026-10-12",
      "summary": "Original 2014 correspondence and engineering records show why Joachim Chao's consortium declined a proposed GADECO deal: disputed historical financials, a $1.6B asking price, and projections dependent on future oil production.",
      "publication_url": "https://grokarchivehub.com/investigations/barak-gadeco-fee-2014",
      "source_manifest_url": "https://grokarchivehub.com/evidence-data/barak-gadeco-fee-2014/source-manifest.json",
      "primary_source_url": "",
      "evidence_boundary": "A proposed $1.6B acquisition and contingent fees are not a verified sale or payment."
    },
    {
      "id": "barak-saudi-rothschild-proposal-2015",
      "type": "investigation",
      "category": "Business and documentary history",
      "title": "A Proposed $200 Million Saudi–Israeli Healthcare Fund, Documented but Not Funded",
      "published": "2026-10-12",
      "modified": "2026-10-12",
      "summary": "2015 correspondence describes Saudi investor recruitment, a proposed Luxembourg healthcare fund naming Ehud Barak, and preliminary Rothschild discussions. No funding or launch is proven.",
      "publication_url": "https://grokarchivehub.com/investigations/barak-saudi-rothschild-proposal-2015",
      "source_manifest_url": "https://grokarchivehub.com/evidence-data/barak-saudi-rothschild-proposal-2015/source-manifest.json",
      "primary_source_url": "",
      "evidence_boundary": "A 2015 proposed fund is not evidence that the vehicle was financed or launched."
    },
    {
      "id": "barak-ushakov-2013-2015",
      "type": "investigation",
      "category": "Government contacts",
      "title": "Barak's 2015 Putin Meeting Request: An Official Refusal, Not a Completed Appointment",
      "published": "2026-10-12",
      "modified": "2026-10-12",
      "summary": "A Russian presidential aide's office declined a June 2015 appointment request from Ehud Barak. Separate claims of an earlier Putin meeting require independent corroboration.",
      "publication_url": "https://grokarchivehub.com/investigations/barak-ushakov-2013-2015",
      "source_manifest_url": "https://grokarchivehub.com/evidence-data/barak-ushakov-2013-2015/source-manifest.json",
      "primary_source_url": "",
      "evidence_boundary": "A documented refused appointment is not proof of an earlier or completed meeting."
    },
    {
      "id": "barak-14-leads-evidence-index",
      "type": "investigation",
      "category": "Source comparison",
      "title": "Fourteen Barak Archive Leads: Verified Documents, Corrections and Open Receipts",
      "published": "2026-10-12",
      "modified": "2026-10-12",
      "summary": "The Barak archive evidence ledger reconciles 14 leads, clarifies the GADECO timeline and the Rialm-NYC deed, and preserves uncertainty about meetings and payments.",
      "publication_url": "https://grokarchivehub.com/investigations/barak-14-leads-evidence-index",
      "source_manifest_url": "",
      "primary_source_url": "",
      "evidence_boundary": "Leads and records carry different proof levels; the index distinguishes proposed from completed."
    },
    {
      "id": "norway-brende-epstein-hearing-2026",
      "type": "investigation",
      "category": "Public testimony",
      "title": "Børge Brende & Epstein: Norway’s 2017 Email Question",
      "published": "2026-10-05",
      "modified": "2026-10-05",
      "summary": "A source-first reconstruction of Børge Brende’s September 30, 2026 parliamentary testimony: his stated 2018 first meeting with Jeffrey Epstein, the unresolved 2017 “Norwegian friend” email, the 2018 WEF/UN exchange, and the limits of the record.",
      "publication_url": "https://grokarchivehub.com/investigations/norway-brende-epstein-hearing-2026",
      "source_manifest_url": "https://grokarchivehub.com/evidence-data/norway-brende-hearing/source-manifest.json",
      "primary_source_url": "",
      "evidence_boundary": "2017 references and the claimed first meeting require separate corroboration."
    },
    {
      "id": "george-mitchell-epstein-source-audit",
      "type": "investigation",
      "category": "Allegation audit",
      "title": "George Mitchell in the Epstein Records: What Resolves Cleanly—and What Does Not",
      "published": "2026-10-06",
      "modified": "2026-10-06",
      "summary": "A source audit separating George Mitchell from namesake collisions, sworn allegations, denials, post-2008 contact records, and unresolved attribution questions in the Epstein archive.",
      "publication_url": "https://grokarchivehub.com/investigations/george-mitchell-epstein-source-audit",
      "source_manifest_url": "https://grokarchivehub.com/evidence-data/george-mitchell-epstein-source-audit/source-manifest.json",
      "primary_source_url": "",